{
  "$schema": "https://json-schema.org/draft/2020-12/schema",
  "$id": "https://scopebond.com/schema/policy-1.0.json",
  "title": "Scopebond policy document (vocabulary v1)",
  "description": "Closed schema: unknown clause types or fields make a policy invalid (POLICY_VOCABULARY.md §6). Amounts are integers in the asset's declared decimals; windows are ISO-8601 durations; times are UTC.",
  "type": "object",
  "required": ["vocabulary_version", "policy_id", "version", "clauses"],
  "additionalProperties": false,
  "properties": {
    "vocabulary_version": { "const": "1.0" },
    "assets": {
      "type": "object",
      "additionalProperties": {
        "type": "object",
        "required": ["decimals"],
        "additionalProperties": false,
        "properties": { "decimals": { "type": "integer", "minimum": 0, "maximum": 18 } }
      }
    },
    "policy_id": { "type": "string", "minLength": 1 },
    "version": { "type": "integer", "minimum": 1, "maximum": 9007199254740991 },
    "agent_id": { "type": "string" },
    "clauses": { "type": "array", "minItems": 1, "items": { "$ref": "#/$defs/clause" } }
  },
  "$defs": {
    "mode": { "enum": ["enforce", "monitor", "require_approval"] },
    "duration": { "type": "string", "pattern": "^P(?=.+)(?:[0-9]+D)?(?:T(?=.+)(?:[0-9]+H)?(?:[0-9]+M)?(?:[0-9]+S)?)?$" },
    "nonEmptyStrings": {
      "type": "array", "minItems": 1, "uniqueItems": true,
      "items": { "type": "string", "minLength": 1 }
    },
    "scalarBound": {
      "type": "object", "additionalProperties": false, "minProperties": 1,
      "properties": {
        "min": { "type": "number" },
        "max": { "type": "number" },
        "enum": { "type": "array", "minItems": 1, "uniqueItems": true, "items": { "type": ["string", "number", "boolean", "null"] } },
        "pattern": { "type": "string" }
      }
    },
    "paramBound": {
      "oneOf": [
        { "$ref": "#/$defs/scalarBound" },
        {
          "type": "object", "additionalProperties": false, "required": ["items"],
          "description": "Array-element bound: each element (match:all, default) or at least one (match:any) must satisfy items.",
          "properties": {
            "items": { "$ref": "#/$defs/scalarBound" },
            "match": { "enum": ["all", "any"] }
          }
        }
      ]
    },
    "clauseBase": {
      "type": "object",
      "required": ["id", "type"],
      "properties": {
        "id": { "type": "string", "minLength": 1 },
        "type": { "type": "string" },
        "mode": { "$ref": "#/$defs/mode" },
        "description": { "type": "string" }
      }
    },
    "clause": {
      "allOf": [{ "$ref": "#/$defs/clauseBase" }],
      "oneOf": [
        { "$ref": "#/$defs/spend_limit" },
        { "$ref": "#/$defs/rate_limit" },
        { "$ref": "#/$defs/address_allowlist" },
        { "$ref": "#/$defs/address_denylist" },
        { "$ref": "#/$defs/contract_allowlist" },
        { "$ref": "#/$defs/endpoint_allowlist" },
        { "$ref": "#/$defs/endpoint_denylist" },
        { "$ref": "#/$defs/action_allowlist" },
        { "$ref": "#/$defs/time_window" },
        { "$ref": "#/$defs/require_approval" },
        { "$ref": "#/$defs/sequence" },
        { "$ref": "#/$defs/oracle_condition" },
        { "$ref": "#/$defs/key_policy" },
        { "$ref": "#/$defs/force_push_guard" }
      ]
    },
    "spend_limit": {
      "type": "object", "additionalProperties": false,
      "required": ["id", "type", "asset"],
      "dependentRequired": { "max_per_window": ["window"] },
      "anyOf": [
        { "required": ["max_per_action"] },
        { "required": ["max_per_window", "window"] }
      ],
      "properties": {
        "id": {}, "mode": {}, "description": {},
        "type": { "const": "spend_limit" },
        "asset": { "type": "string" },
        "max_per_action": { "type": "integer", "minimum": 0, "maximum": 9007199254740991 },
        "max_per_window": { "type": "integer", "minimum": 0, "maximum": 9007199254740991 },
        "window": { "$ref": "#/$defs/duration" },
        "scope": { "enum": ["principal", "global"] },
        "action_types": { "$ref": "#/$defs/nonEmptyStrings" }
      }
    },
    "rate_limit": {
      "type": "object", "additionalProperties": false,
      "required": ["id", "type", "action_types", "max_count", "window"],
      "properties": {
        "id": {}, "mode": {}, "description": {},
        "type": { "const": "rate_limit" },
        "action_types": { "$ref": "#/$defs/nonEmptyStrings" },
        "max_count": { "type": "integer", "minimum": 0, "maximum": 9007199254740991 },
        "window": { "$ref": "#/$defs/duration" },
        "scope": { "enum": ["principal", "global"] }
      }
    },
    "address_allowlist": {
      "type": "object", "additionalProperties": false,
      "required": ["id", "type", "addresses"],
      "properties": {
        "id": {}, "mode": {}, "description": {},
        "type": { "const": "address_allowlist" },
        "addresses": { "$ref": "#/$defs/nonEmptyStrings" },
        "chain_ids": { "type": "array", "items": { "type": "integer" } }
      }
    },
    "address_denylist": {
      "type": "object", "additionalProperties": false,
      "required": ["id", "type", "addresses"],
      "properties": {
        "id": {}, "mode": {}, "description": {},
        "type": { "const": "address_denylist" },
        "addresses": { "$ref": "#/$defs/nonEmptyStrings" },
        "chain_ids": { "type": "array", "items": { "type": "integer" } },
        "best_effort": { "type": "boolean" }
      }
    },
    "contract_allowlist": {
      "type": "object", "additionalProperties": false,
      "required": ["id", "type", "contracts"],
      "properties": {
        "id": {}, "mode": {}, "description": {},
        "type": { "const": "contract_allowlist" },
        "contracts": { "$ref": "#/$defs/nonEmptyStrings" },
        "selectors": { "type": "array", "items": { "type": "string" } },
        "chain_ids": { "type": "array", "items": { "type": "integer" } }
      }
    },
    "endpoint_allowlist": {
      "type": "object", "additionalProperties": false,
      "description": "Allows only the listed destinations. Each host is a name or IP address with an optional port, compared as the destination an HTTP client reaches (case, a trailing dot and the decimal, octal, hex, shortened and IPv4-mapped IPv6 spellings of an address do not matter). An entry allows exactly its host and port; one without a port allows the default port only. The preferred control for agent egress.",
      "required": ["id", "type", "hosts"],
      "properties": {
        "id": {}, "mode": {}, "description": {},
        "type": { "const": "endpoint_allowlist" },
        "hosts": { "$ref": "#/$defs/nonEmptyStrings" },
        "paths": { "type": "array", "items": { "type": "string" } },
        "methods": { "type": "array", "items": { "type": "string" } }
      }
    },
    "endpoint_denylist": {
      "type": "object", "additionalProperties": false,
      "description": "Denies the listed destinations, compared as for endpoint_allowlist. An entry without a port denies its host on every port; a loopback name or address (localhost, 127.0.0.0/8, ::1, 0.0.0.0) denies every loopback destination. A name is compared as a name: list an internal service's address to deny it under any name (a dispatching HTTP executor also checks the address a name resolves to). Best effort: prefer endpoint_allowlist for egress control.",
      "required": ["id", "type", "hosts"],
      "properties": {
        "id": {}, "mode": {}, "description": {},
        "type": { "const": "endpoint_denylist" },
        "hosts": { "$ref": "#/$defs/nonEmptyStrings" },
        "paths": { "type": "array", "items": { "type": "string" } },
        "methods": { "type": "array", "items": { "type": "string" } }
      }
    },
    "action_allowlist": {
      "type": "object", "additionalProperties": false,
      "required": ["id", "type", "action_types"],
      "properties": {
        "id": {}, "mode": {}, "description": {},
        "type": { "const": "action_allowlist" },
        "action_types": { "$ref": "#/$defs/nonEmptyStrings" },
        "param_bounds": {
          "type": "object", "minProperties": 1,
          "additionalProperties": { "$ref": "#/$defs/paramBound" }
        },
        "exceptions": {
          "description": "Sets of bounds that excuse an action from param_bounds: an action that meets every bound of one set is not checked against them. A field the action does not carry, or an empty list for an items bound, never meets a bound.",
          "type": "array", "minItems": 1, "maxItems": 50,
          "items": {
            "type": "object", "minProperties": 1, "maxProperties": 16,
            "additionalProperties": { "$ref": "#/$defs/paramBound" }
          }
        }
      }
    },
    "time_window": {
      "type": "object", "additionalProperties": false,
      "required": ["id", "type", "start", "end"],
      "properties": {
        "id": {}, "mode": {}, "description": {},
        "type": { "const": "time_window" },
        "days": { "type": "array", "items": { "type": "string" } },
        "start": { "type": "string", "pattern": "^(?:[01][0-9]|2[0-3]):[0-5][0-9]$" },
        "end": { "type": "string", "pattern": "^(?:[01][0-9]|2[0-3]):[0-5][0-9]$" },
        "timezone": { "const": "UTC" }
      }
    },
    "require_approval": {
      "type": "object", "additionalProperties": false,
      "required": ["id", "type", "action_types", "approvers"],
      "properties": {
        "id": {}, "mode": {}, "description": {},
        "type": { "const": "require_approval" },
        "action_types": { "$ref": "#/$defs/nonEmptyStrings" },
        "approvers": { "$ref": "#/$defs/nonEmptyStrings" },
        "min_approvals": { "type": "integer", "minimum": 1 },
        "timeout": { "$ref": "#/$defs/duration" }
      }
    },
    "sequence": {
      "type": "object", "additionalProperties": false,
      "required": ["id", "type", "first_action_types", "then_action_types"],
      "anyOf": [{ "required": ["min_gap"] }, { "required": ["forbidden_within"] }],
      "properties": {
        "id": {}, "mode": {}, "description": {},
        "type": { "const": "sequence" },
        "first_action_types": { "$ref": "#/$defs/nonEmptyStrings" },
        "then_action_types": { "$ref": "#/$defs/nonEmptyStrings" },
        "min_gap": { "$ref": "#/$defs/duration" },
        "forbidden_within": { "$ref": "#/$defs/duration" }
      }
    },
    "oracle_condition": {
      "type": "object", "additionalProperties": false,
      "required": ["id", "type", "oracle_id", "predicate", "best_effort"],
      "properties": {
        "id": {}, "mode": {}, "description": {},
        "type": { "const": "oracle_condition" },
        "oracle_id": { "type": "string" },
        "predicate": { "type": "string" },
        "best_effort": { "const": true }
      }
    },
    "key_policy": {
      "type": "object", "additionalProperties": false,
      "required": ["id", "type", "active_keys"],
      "properties": {
        "id": {}, "mode": {}, "description": {},
        "type": { "const": "key_policy" },
        "active_keys": { "$ref": "#/$defs/nonEmptyStrings" },
        "rotation_delay": { "$ref": "#/$defs/duration" },
        "max_key_age": { "$ref": "#/$defs/duration" }
      }
    },
    "force_push_guard": {
      "type": "object", "additionalProperties": false,
      "required": ["id", "type"],
      "properties": {
        "id": {}, "mode": {}, "description": {},
        "type": { "const": "force_push_guard" },
        "protected_refs": { "$ref": "#/$defs/nonEmptyStrings" }
      }
    }
  }
}
