{
  "vocabulary_version": "1.0",
  "assets": { "USDC": { "decimals": 2 } },
  "policy_id": "demo-agent",
  "version": 1,
  "clauses": [
    { "id": "tx-cap", "type": "spend_limit", "mode": "enforce", "asset": "USDC", "max_per_action": 1000000, "description": "No single payment above $10,000" },
    { "id": "daily", "type": "spend_limit", "mode": "monitor", "asset": "USDC", "max_per_window": 5000000, "window": "P1D", "scope": "principal", "description": "No more than $50,000/day (monitored)" },
    { "id": "keys", "type": "key_policy", "active_keys": ["key:agent-demo"], "description": "Only the current agent key may sign" }
  ]
}
